{"$schema":"https://json-schema.org/draft/2020-12/schema","title":"Static Cover Collage Spec","type":"object","additionalProperties":false,"required":["schema_version","output","width","height","layout","sources","text","overwrite"],"properties":{"schema_version":{"const":1},"output":{"type":"string","pattern":"^(?!/)(?!.*\\.\\.)[^\\0]+$"},"width":{"type":"integer","minimum":1,"maximum":8192},"height":{"type":"integer","minimum":1,"maximum":8192},"layout":{"type":"object","oneOf":[{"required":["preset"]},{"required":["cells"]}]},"sources":{"type":"array","minItems":2,"maxItems":6,"items":{"type":"object","required":["path","focus_x","focus_y","role"],"properties":{"path":{"type":"string"},"focus_x":{"type":"number","minimum":0,"maximum":1},"focus_y":{"type":"number","minimum":0,"maximum":1},"role":{"type":"string"}}}},"text":{"type":"object","properties":{"accent_headline":{"type":"string"},"primary":{"type":"string"},"keywords":{"type":"string"}}},"colors":{"type":"object"},"overwrite":{"type":"boolean"}}}
