{
  "schema_version": 1,
  "output": "exports/youtube-shorts-cover-v1.jpg",
  "width": 2160,
  "height": 3840,
  "layout": {"preset": "youtube_shorts_cover"},
  "sources": [
    {"path": "photos/hero.jpg", "focus_x": 0.5, "focus_y": 0.5, "role": "hero"},
    {"path": "photos/people.jpg", "focus_x": 0.5, "focus_y": 0.5, "role": "support_left"},
    {"path": "photos/detail.jpg", "focus_x": 0.5, "focus_y": 0.5, "role": "support_right"}
  ],
  "text": {"accent_headline": "ПЕКИН", "primary": "ПУТЕШЕСТВИЕ", "keywords": "ЗООПАРК · ПАНДЫ · ТИГРЫ"},
  "colors": {"text_panel": "#141414", "accent": "#FFD700", "primary": "#FFFFFF", "keywords": "#FFFFFF", "stroke": "#000000"},
  "overwrite": false
}
